{
  "schema_version": "amy.model-review-protocol.v1",
  "protocol_id": "MRP-2026-07-13-v1",
  "status": "frozen_for_next_exploratory_round",
  "classification": "exploratory_advisory_not_scientific_evidence",
  "purpose": "Obtain ten role-separated adversarial critiques of the current pre-R0 design and implementation, preserving complete availability and failure evidence while preventing model agreement, verbosity, or provider prestige from becoming scientific evidence.",
  "execution": {
    "slot_count": 10,
    "max_parallel_requests": 10,
    "attempts_per_slot": 1,
    "retry_allowed": false,
    "failed_slot_replacement_allowed": false,
    "timeout_seconds": 900,
    "stream": false,
    "think": false,
    "temperature": 0,
    "num_predict": 8000,
    "request_format": "closed_json_schema",
    "source_inventory_pre_post_required": true
  },
  "common_source_paths": [
    "README.md",
    "evidence/SOURCE_LEDGER.md",
    "protocol/CLAIM_BOUNDARIES.md",
    "protocol/PRE_R0_CLOSURE_LEDGER.json",
    "protocol/PROTOCOL_DRAFT.md",
    "protocol/REGISTRATION_GATES.json"
  ],
  "review_slots": [
    {
      "slot_id": "MR-01",
      "model_label": "glm-5.2:cloud",
      "observed_registration_digest": "ce8fd6f94793a6786f6858717b38067feba631861e3b35e8122cb6635004cd4a",
      "role": "cryptography, trust-policy, and signature-verification reviewer",
      "question": "Find cryptographic, identity, canonicalization, trusted-root, transparency, signature-policy, and SHA/version-lineage defects. Distinguish byte identity, authentication, provenance conformance, and scientific truth.",
      "source_paths": [
        "amy_verifier/github_attestation_v2.py",
        "audit/RELEASE_IDENTITY_VERSION_SHA_SIGNATURE_AUDIT_2026-07-13.md",
        "protocol/GITHUB_ATTESTATION_POLICY_TEMPLATE_V2.json",
        "protocol/PRODUCTION_SIGSTORE_GATE_DRAFT.md",
        "protocol/RELEASE_LINEAGE_CONTRACT_DRAFT.json",
        "protocol/VERSIONING_AND_SIGNING_POLICY.md",
        "schemas/github-attestation-policy-v2.schema.json",
        "schemas/github-production-verification-result-v2.schema.json"
      ]
    },
    {
      "slot_id": "MR-02",
      "model_label": "kimi-k2.7-code:cloud",
      "observed_registration_digest": "eda07a6592375dcbde7cf167b6d6b368cdd28e244f9d71559fb59919aca882fa",
      "role": "verification implementation, invariant, and adversarial-test reviewer",
      "question": "Audit executable behavior rather than documentation. Find mismatches between schemas, policies, implementations, tests, and retained receipts, including fail-open paths and untested invariants.",
      "source_paths": [
        "amy_verifier/confirmatory_runner.py",
        "amy_verifier/selected_profile_fixture.py",
        "amy_verifier/selected_profile_mutations.py",
        "amy_verifier/verifier.py",
        "scripts/validate_protocol.py",
        "tests/test_confirmatory_runner_contract.py",
        "tests/test_selected_profile_base_aware_mutations.py",
        "tests/test_toctou_and_fault_injection.py"
      ]
    },
    {
      "slot_id": "MR-03",
      "model_label": "deepseek-v4-pro:cloud",
      "observed_registration_digest": "22bfd5026abd64524341f1f90c4885c91a879767c39e3e39a4a3f000b3d0815f",
      "role": "adversarial systems-security and abuse-path reviewer",
      "question": "Construct realistic abuse paths across process containment, filesystem races, hidden retries, network channels, output exposure, identity substitution, and evidence publication. Identify which claimed controls are only local assertions.",
      "source_paths": [
        "amy_verifier/confirmatory_runner.py",
        "protocol/CONFIRMATORY_RUNNER_CONTRACT_DRAFT.md",
        "protocol/RUN_EXECUTION_POLICY_DRAFT.json",
        "protocol/THREAT_MODEL.md",
        "schemas/environment-attempt-record.schema.json",
        "schemas/official-attempt-selection.schema.json",
        "tests/test_confirmatory_runner_contract.py"
      ]
    },
    {
      "slot_id": "MR-04",
      "model_label": "deepseek-v4-flash:cloud",
      "observed_registration_digest": "ea027821675c940f02cd3be0762002a8268c3d101fbbbf479f1f5c2025a8dfe6",
      "role": "claim-evidence, citation, and internal-consistency reviewer",
      "question": "Trace every major claim to retained evidence and primary sources. Find stale counts, unsupported wording, circular validation, misleading terminology, and places where local replay is described too strongly.",
      "source_paths": [
        "audit/LATEST_MANUSCRIPTS_CODE_DATA_PDF_AND_REFERENCE_AUDIT_2026-07-13.md",
        "evidence/CLAIM_EVIDENCE_MATRIX.csv",
        "protocol/LIMITATIONS_AND_BOUNDARIES.md",
        "protocol/PROPOSITION_MATRIX_DRAFT.json",
        "reviews/R0_REVIEW_PACKET_DRAFT.md",
        "scripts/validate_protocol.py"
      ]
    },
    {
      "slot_id": "MR-05",
      "model_label": "kimi-k2.6:cloud",
      "observed_registration_digest": "a90cd0d1590c53b9f9f4e0f66218e4c514d190652b8bed2842528e2530e34dc6",
      "role": "experimental-design, finite-corpus, and missingness reviewer",
      "question": "Audit units, denominators, compatibility, missingness, retries, stopping, deterministic replication, endpoint definitions, falsification rules, and any unjustified population or causal interpretation.",
      "source_paths": [
        "corpus/COMPATIBILITY_MATRIX_SELECTED_PROFILE_DRAFT.json",
        "dummy_analysis/DUMMY_ANALYSIS_SUMMARY.json",
        "preregistration/OSF_PREREGISTRATION_DRAFT.md",
        "protocol/PROPOSITION_MATRIX_DRAFT.json",
        "protocol/RUN_EXECUTION_POLICY_DRAFT.json",
        "schemas/analysis-summary.schema.json",
        "scripts/analyze_observation_ledger.py"
      ]
    },
    {
      "slot_id": "MR-06",
      "model_label": "glm-5.1:cloud",
      "observed_registration_digest": "59472abf9d0aab2eb1b0106ba1c1f59266a00ed41f63d2a2b1db082e7346b982",
      "role": "open-science, preregistration, human-review, and artifact reviewer",
      "question": "Audit whether another group could identify, obtain, verify, execute, and cite every frozen stage. Find mutable identities, missing licenses, absent registration evidence, reviewer conflicts, and artifact-badging overclaims.",
      "source_paths": [
        "preregistration/OSF_PREREGISTRATION_DRAFT.md",
        "protocol/R0_HUMAN_REVIEW_RECORD_TEMPLATE.json",
        "protocol/R0_REVIEWER_IDENTITY_POLICY_TEMPLATE.json",
        "protocol/RELEASE_LINEAGE_CONTRACT_DRAFT.json",
        "protocol/VERSIONING_AND_SIGNING_POLICY.md",
        "reviews/R0_REVIEW_PACKET_DRAFT.md",
        "schemas/r0-human-review-record.schema.json"
      ]
    },
    {
      "slot_id": "MR-07",
      "model_label": "nemotron-3-super:cloud",
      "observed_registration_digest": "be3943c5a818be61a08f3563b971e392bfc12e506e296fb186c870f5c63377a4",
      "role": "software supply-chain, in-toto, SLSA, and CI reviewer",
      "question": "Audit subject binding, builder identity, materials, source revision, dirty state, workflow/ref policy, action pins, trusted roots, offline verification, and the boundary between attested claims and externally established facts.",
      "source_paths": [
        "amy_verifier/github_attestation_v2.py",
        "audit/UPSTREAM_ATTESTATION_SEMANTICS_2026-07-13.md",
        "protocol/GITHUB_ATTESTATION_POLICY_TEMPLATE_V2.json",
        "protocol/PRODUCTION_SIGSTORE_GATE_DRAFT.md",
        "schemas/github-attestation-policy-v2.schema.json",
        "schemas/manifest-production-v0.2.schema.json"
      ]
    },
    {
      "slot_id": "MR-08",
      "model_label": "minimax-m2.7:cloud",
      "observed_registration_digest": "06daa293c105f0bd71fd19420e4d15cae66cc5f71cb8f55b4f998e96ec8ab67a",
      "role": "skeptical systems-paper program-committee reviewer",
      "question": "Assume the future paper will be rejected unless contribution, novelty, evaluation scope, threat model, artifacts, and limitations are exact. Identify fatal framing defects and the minimum evidence needed for a defensible paper.",
      "source_paths": [
        "audit/AMY_SYSTEM_PAPER_CODE_DATA_PDF_AUDIT_2026-07-13.md",
        "audit/ATLAS_DEEP_CODE_AND_ARTIFACT_AUDIT_2026-07-13.md",
        "audit/AXIOM_DEEP_CODE_ARTIFACT_AND_PAPER_AUDIT_2026-07-13.md",
        "protocol/LIMITATIONS_AND_BOUNDARIES.md",
        "protocol/PROPOSITION_MATRIX_DRAFT.json",
        "protocol/THREAT_MODEL.md"
      ]
    },
    {
      "slot_id": "MR-09",
      "model_label": "qwen3.5:cloud",
      "observed_registration_digest": "a7bf6f7891c3c5189353c5e330f57563991f5cceabbe830c941619f24dc4dbca",
      "role": "model-drift, opaque-provider, and computational-reproducibility reviewer",
      "question": "Audit all claims involving model identity, cloud labels, serving state, seeds, temperatures, raw exchanges, determinism, model voting, and the distinction between reproducible requests and unreproducible provider internals.",
      "source_paths": [
        "protocol/LIMITATIONS_AND_BOUNDARIES.md",
        "protocol/MODEL_REVIEW_PROTOCOL.json",
        "protocol/VERSIONING_AND_SIGNING_POLICY.md",
        "reviews/README.md",
        "scripts/run_model_review_batch.py",
        "scripts/run_protocol_review.py"
      ]
    },
    {
      "slot_id": "MR-10",
      "model_label": "mistral-large-3:675b-cloud",
      "observed_registration_digest": "3130fd5a5a1eb4b208be74bf0273357c14c3576c6ba8d78f98b960e91919d77b",
      "role": "statistics, endpoint, reporting, and overclaiming reviewer",
      "question": "Audit descriptive statistics, finite-population interpretation, aggregation, multiplicity language, error and missing categories, determinism claims, tables/figures, abstract eligibility, and negative-result reporting.",
      "source_paths": [
        "dummy_analysis/DUMMY_ANALYSIS_SUMMARY.json",
        "preregistration/OSF_PREREGISTRATION_DRAFT.md",
        "protocol/CLAIM_BOUNDARIES.md",
        "protocol/PROPOSITION_MATRIX_DRAFT.json",
        "schemas/analysis-summary.schema.json",